{
  "schema_version": "0.1.0",
  "record_id": "c3e8a0d4-1f27-4b6a-9e55-7d0c2b8f6a31",
  "submitted_at": "2026-09-27T10:03:10Z",
  "source": {
    "source_type": "field_report",
    "client": "claude-code",
    "client_version": "2.1.200",
    "collector": "stop-hook",
    "submit_mode": "all_runs",
    "install_key_sig": null
  },
  "task": {
    "l1": "coding",
    "l2": "coding.feature",
    "taxonomy_version": "t0.1",
    "classifier": "rules-v0",
    "interaction_type": "agentic",
    "difficulty_prior": { "files_touched": 5, "context_tokens": 61500 }
  },
  "model": { "provider": "example", "id": "example-model-b", "route": "proxy", "effort": null },
  "method": {
    "harness": "claude-code",
    "workflow_tags": ["plan-mode"],
    "tools_used": ["Bash", "Edit", "Read", "Write"]
  },
  "usage": {
    "input_tokens": 5120,
    "output_tokens": 7400,
    "cache_read_tokens": 388000,
    "cache_write_tokens": 30100,
    "cost_usd_client": null,
    "cost_usd_server": 0.87,
    "latency_ms": 212000,
    "turns": 17
  },
  "outcome": {
    "status": "completed",
    "evidence": {
      "test_cmd_detected": true,
      "test_runs": 3,
      "tests_passed": false,
      "committed": false,
      "tool_error_count": 4,
      "reverted_within_7d": null,
      "user_retry_next_prompt": true
    },
    "self_assessment": { "score": 0.95, "rater": "self_llm", "judge_model": null }
  },
  "pairing": { "pair_id": null },
  "privacy": { "content_included": false, "identifiers_included": false }
}
